What are the two longest rivers in California?	People are very worried'. Government scientists say it's important to understand that the Sacramento and the San Joaquin, the state's two longest rivers, are the hub of the water supply for 3 million acres of farmland and 25 million residents.	2
What is the purpose of Wasatia?	He is no stranger to controversy. The director of the American studies program at Al Quds University, Dajani heads an organization called Wasatia, whose declared aim is to promote a culture of moderation and reconciliation among Palestinians - values that often seem in short supply in the festering conflict with Israel.	2
What motivated Professor Mohammed Dajani to take Palestinian students to Poland to visit the site of the Auschwitz concentration camp?	'In my community you see a lot of ignorance of the Holocaust, denial of the Holocaust.	2
What kind of instruments do the Hollywood Film Orchestra bring on tour?	'Nicest hall in China and they give me the crappiest drum kit!' he exclaimed, pointing at the pitted and sagging drum heads.	2
What happened when the Hollywood Film Orchestra arrived in Beijing?	(Nolan got his new drum heads 20 minutes before the curtain went up for the show, called 'Classic Oscar: The American Hollywood Film Orchestra New Year's Audio-Visual Concert'.)	2
What is the purpose of the Hollywood Film Orchestra's tour of China?	The orchestra's grueling schedule - 5:30 a.m. wake-ups, 11 p.m. dinners, with travel, rehearsal and performances in between - attests to the popularity of Hollywood fare in China as well as the seemingly insatiable demand for Western orchestral music as the country invests heavily in new concert venues and classical music education.	2
What are the benefits of using solar-powered tags to track sharks?	'We've learned a lot from tagging sharks, not least of which is that they are highly migratory,' said Antonio Fins, executive director of the Guy Harvey Ocean Foundation, which supports the institute.	2
What about children from lower-income families?	But a study published this week in the journal PNAS suggests that among adolescents, the hopeful signs are limited to those from better-educated, more affluent families.	2
What percentage of adolescents living with parents who had college degrees said they had exercised or played a sport for at least 20 minutes continuously sometime in the last seven days in 2003 and 2011?	By 2011, 90.1 percent said they had done so.	2
What are the potential consequences of the Supreme Court's decision?	California Solicitor General Edward C. Dumont, whom President Barack Obama once nominated to the federal bench, will join with Obama's Deputy Solicitor General Michael R. Dreeben in urging the court to give law enforcement leeway in searching smartphones.	2
What charges did the police arrest the man on?	Those charges set the stage for the first war crimes trial since World War II.	2
What prompted Germany's cultural elite to decide the book was not a serious work?	Although Sack's facts were not disputed, Germany's cultural elite decided the book was not a serious work and, worse, could be exploited by right-wing extremists to try to diminish the Nazis' murder of 6 million Jews.	2
What was the reaction of German intellectuals to the book 'An Eye for an Eye: The Untold Story of Jewish Revenge Against Germans in 1945'?	German intellectuals do not dispute that some Jews committed atrocities against innocent Germans immediately after the war, but find it understandable considering the evil the Nazis unleashed.	2
What is Allen Johnson's nationality?	Johnson ran collegiately for North Carolina.	2
What are the two sides negotiating for?	All factions in Northern Ireland, divided broadly into pro-British Protestant and Irish Catholic camps, are waiting to see which side the document will favor.	2
What were the main obstacles that needed to be overcome?	But efforts to agree on the so-called 'framework document,' spelling out how Britain and the Irish Republic view the likely terms of compromise, had run into trouble.	2
What is the main issue that has been slowing down the peacemaking efforts?	Northern Ireland's moderate Catholics and the Irish government insist that a cross-border body must form part of any package, to balance out a key symbolic concession from their side: the ending or amending of the south's territorial claim to Northern Ireland.	2
What kind of explosives were found in the chicken coop?	The report said the explosives were believed to belong to Hamas.	2
What are the potential benefits of Mexico's move towards democracy?	But how this will improve the lives of most Mexicans remains to be seen.	2
What are the challenges Ernesto Zedillo faces in his efforts to bring democracy to Mexico?	'He's trying to be all things to all people,' she said.	2
What are the two main challenges facing President Zedillo?	Critics from Cardenas' Democratic Revolution Party, or PRD, called Zedillo's policy 'incoherent.'	2
What evidence led the University of Pennsylvania archaeologists to believe that the tomb belonged to a previously unknown pharaoh?	By analyzing fragmented parts of the list, a Danish researcher named Kim Ryholt proposed years ago that 16 unknown kings belonged to the Abydos dynasty.	2
What is the name of the tomb's occupant?	The name of Senebkay matches one of the partial names on the list, said Wegner, who identified the tomb's occupant with the help of graduate student Kevin Cahail.	2
What happened to the other names on the list?	'In the later king lists, they don't appear.	2
What was the name of the unknown pharaoh?	Preliminary work on the skeleton, conducted by Penn graduate students Paul Verhelst and Matthew Olson, suggests that Senebkay stood about 5 feet, 10 inches tall and died in his mid- to late 40s.	2
What other discoveries have been made at the site?	The tombs of other apparent members of the dynasty are thought to lie nearby.	2
What measures have been taken to conserve water in Willits?	The 5,000 residents of this former lumber town in Mendocino County on the edge of redwood country are now on a crash water diet.	2
What is the current water situation in California?	Only about half the rainy season is over.	2
What are the water restrictions in Willits, California?	And growers with the most senior water rights on the Sacramento and San Joaquin rivers won't suffer more than a 25 percent cut in irrigation deliveries.	2
What was the decision of the 9th U.S. Circuit Court of Appeals?	The sweeping, unanimous decision Tuesday by a three-judge panel of the 9th U.S.	2
What is the purpose of the letter?	We need to make it sexier and more relevant in a highly competitive market,' said Paul B. Redman, director of Longwood Gardens in Kennett Square, Pa., and a strong supporter of a four-year remedial campaign outlined in the letter.	2
What is horticulture?	More often, in the public mind, 'it's a guy with a pickup truck and a lawn mower, a low-paying job requiring manual labor and no college degree,' said Mary H. Meyer, horticultural science professor at the University of Minnesota and, as president of the American Society for Horticultural Science, a critical force in the campaign.	2
What are some of the career opportunities in horticulture?	In a report in May, the Royal Horticultural Society decried 'an alarming shortage of skilled professionals' in horticulture jobs, posing 'a threat to Britain's economy, environment, and food security'.	2
What is the economic impact of the virus on the honeybee industry?	In California, the $3 billion almond industry spends $239 million annually to rent more than 1 million beehives, and that cost is escalating.	2
What is the name of the virus that has been found in honeybees?	The tobacco ringspot virus acts as a 'quasi-species,' replicating in a way that creates ample mutations that subvert the host's immune response.	2
What is the cause of colony collapse disorder?	But we do have evidence that TRSV along with other viruses that we screen on a regular basis are associated with lower rates of over-winter survival'.	2
What is the correlation between the virus and the weak colonies?	Indeed, the new virus, along with the well documented Israeli Acute Paralysis Virus, was correlated with colonies deemed 'weak' due to a variety of stresses.	2
What is the main problem with Rio's Guanabara Bay?	Critics say the boats do little to address the more pressing question of sewage.	2
What is the main problem with Rio de Janeiro's Guanabara Bay?	With limited trash and sewage services in this sprawling metropolis of 6 million people, tons of garbage and raw waste flow daily from sludge-filled rivers into the bay, where Olympic and Paralympic sailing events will be held.	2
Does Glenn think that U.S.-made nuclear material is being traded on the black market?	'Given the staggering amount of nuclear materials we have exported, it could only be a matter of time before some of this deadly contraband proves to be of U.S.	2
What tracing efforts are currently in place?	The report said U.S. tracking showed that Japan produced about 20.3 metric tons of plutonium from U.S. materials between 1978 and 1992, but Japanese records showed 58.7 tons.	2
Is this discrepancy concerning to U.S. officials?	'We're looking at those kinds of discrepancies and we are confident that the material is being safeguarded as appropriate by the IAEA (International Atomic Energy Agency,)' said Notra Trulock, chief of intelligence at the U.S. Department of Energy, in an interview Tuesday.	2
What is the political demographic of the Chechen army?	Many Chechens are fighting independently of the forces loyal to Chechen President Dzhokhar Dudayev, and Dudayev's representative at the peace talks, Aslan Maskhadov, has warned that he does not control them.	2
What is the Russian perspective on the conflict?	Emil Pain, an adviser to President Boris Yeltsin, was quoted as saying a 'cooling period after combat operations' is needed before negotiations could take place.	2
Why are parents suffering from financial burden?	The move reflects a national crisis in China's educational system, which is struggling for survival following a withdrawal of most state funding.	2
what are public schools doing to change curriculum?	The circular advised schools to concentrate on improving the quality of 'normal teaching' and it banned competitions and awards geared toward gifted students.	2
What is an effect of the broken education system?	Those trends worry the national leadership, which fears that a poorly educated workforce could become a drag on economic development.	2
Why is Willoughby's participation unusual/noteworthy?	The search for remains of the 2,211 U.S. servicemen unaccounted for from the war rarely requires help from survivors of a specific battle, Garrett said.	2
How is Willoughby's help required?	Willoughby is expected to help outline battlefield positions and trace the course of battle to find out where men might have fallen or been buried.	2
What is the American Hollywood Film Orchestra?	They schlep by bus, train and plane to more than a dozen cities from late December to mid-January, offering up crowd-pleasing medleys from movies such as 'Titanic,' 'Dances With Wolves,' 'The Incredibles' and 'The Godfather'.	2
Is this strategy consistently successful?	On this Saturday evening in Beijing, two cellists opened the cases to the loaner instruments and found the bridge on one had come completely off.	2
Who are the members of the orchestra?	(Trumpeter Stephen Charpie of Buena Park is the lone Californian in the 2013-14 lineup.	2
What does 'highly migratory' entail?	'They are not American sharks or Bahamian sharks or Mexican sharks.	2
Are these campaigns effective?	But a study published this week in the journal PNAS suggests that among adolescents, the hopeful signs are limited to those from better-educated, more affluent families.	2
is the problem related to information distribution?	But if the public health message on obesity 'has not diffused evenly across the population,' as the authors of Monday's report suggest, this disparity could stymie efforts to stem a costly obesity-related diseases in the years ahead.	2
Will this case set a precedent for future action?	The eventual outcome will clarify rules that were written long before phones wised up.	2
Why is it a challenge to fit smartphones into the contours of the Fourth Amendment?	Both rest on the warrant-less searches of devices unimagined at the time the Fourth Amendment was ratified in 1791.	2
What is the current state of the area where the Indian rebels' supporters lived?	Nearly 1,200 people who supported Indian rebels lived here, but the loudest sound now is the breeze rustling through the banana trees.	2
What makes a moonlit beach particularly romantic for a horseshoe crab?	Especially if you're a lusty horseshoe crab and the tide is high.	2
What is unique about the horseshoe crab's existence and its relation to other species?	It is one of the oldest unchanged species on Earth known to scientists, older than the continents, and exists only in parts of Asia and North America's Atlantic coast.	2
What is causing the widespread concern and protests regarding the emergency water management in California?	Besides fear, exactly what is setting everybody off?	2
What was the result of the increased river flow through the delta due to the February and March storms?	And the fight over the extra flow was on.	2
What were the challenges in arranging the visit of Palestinian students to Auschwitz?	Organizing the Palestinian visit to Auschwitz was a sensitive undertaking.	2
Why has the 'E.T.' game been of interest to video game enthusiasts for so long?	The game and its contribution to the demise of Atari have been the source of fascination for video game enthusiasts for 30 years.	2
Is there still a chance for rain to alleviate the drought conditions in California?	Only about half the rainy season is over.	2
What was the outcome of the federal appeals court's decision on excluding prospective jurors based on their sexual orientation?	The sweeping, unanimous decision Tuesday by a three-judge panel of the 9th U.S.	2
What characteristic of the tobacco ringspot virus makes it particularly harmful to honeybees?	'They have a high mutation rate,' said Yan Ping Chen, a bee pathologist at the USDA Agricultural Research Service laboratory in Maryland and lead author of the study.	2
Has the branding of tortoises had any impact on their presence in illegal markets?	So far, no rare tortoise or turtle with identification markings has turned up in illegal markets monitored by law enforcement authorities, conservationists said.	2
What do foreign policy experts say about the issue?	'Scarcely a day goes by without a report of a new black market deal,' said Sen. John Glenn in a statement reacting to the report.	3
What does the report say about the dangerous materials coming from the U.S.?	origin.'	3
What does the report say about the matter?	The report says hundreds of tons of plutonium and highly enriched uranium have accumulated worldwide, mostly from nuclear power generation.	3
What else does the report not include?	Nuclear exports for weapons use or weapons research are prohibited, as is transfer of nuclear materials to a third country.	3
How much plutonium has been produced in the US	The report said U.S. tracking showed that Japan produced about 20.3 metric tons of plutonium from U.S. materials between 1978 and 1992, but Japanese records showed 58.7 tons.	3
What is problematic about the limited cease-fire?	Despite the pact, artillery fire sounded in the Grozny on Tuesday, and there were reports of Chechen missile attacks southwest of the Chechen capital.	3
Why are the peace talks set to resume?	Many Chechens are fighting independently of the forces loyal to Chechen President Dzhokhar Dudayev, and Dudayev's representative at the peace talks, Aslan Maskhadov, has warned that he does not control them.	3
How have previous offers been ignored by the Feisty Mascot?	Similar offers in the past have been ignored by the feisty Chechens.	3
Why do some feel the cease-fire can hold?	Emil Pain, an adviser to President Boris Yeltsin, was quoted as saying a 'cooling period after combat operations' is needed before negotiations could take place.	3
What will happen with the sanctions lifted?	Under the proposal cleared by Clinton and the governments of Britain, France, Germany and Russia, economic sanctions would be lifted -- or later reimposed -- depending on Milosevic's actions.	3
What condition is proposed for lifting sanctions?	The official stressed the sanctions would be lifted only temporarily and would be reimposed if the Serbian leader reneged.	3
What would happen if the Serbian leader did not comply?	Unaffected by the plan, he said, would be Serbia's 'illegitimacy' status on the world stage -- its exclusion from the World Bank and other international groups.	3
What is the current state of the negotiations?	The senior U.S. official in Washington said he was reluctant to divulge details of the proposal even before they were presented to Milosevic.	3
How do Chinese parents feel about these schools?	The elitist nature of such 'Olympic schools,' as they are called, apparently angered Li and other top leaders, who recently began calling for their closure.	3
What will happen to those schools that did not return the fees?	Those schools authorized by provincial, or state, education departments will be allowed only to finish the spring term, it said.	3
What has been the consequence of these 'Olympic schools' not providing basic education to their students	Local authorities, who are expected to shoulder most of the burden, have generally failed to provide the basic minimum expected by the central government, leaving schools with little choice but to run their own profit-making businesses or charge exorbitant fees.	3
What did she say about those who stayed behind?	'Everyone was fleeing,' she said, holding her 7-month-old son, Cesar.	3
What did Cesar do as the soldiers arrived?	'I was trying to get together some diapers for my little one, and we were going to the road when we saw the army had already surrounded us.'	3
What did villagers say about the army's treatment of them?	Many complained that the Zapatistas had taken their food or mistreated them.	3
What happened to the five missing men from the Vietnam war?	Frank C. Willoughby, a retired major in the Army's Special Forces -- known as the Green Berets, will return to Lang Vei, where North Vietnamese tanks and infantry overran a base of camps on Feb. 7, 1968, during the Tet Offensive.	3
How common is it for a veteran of the Vietnam War to return home?	His participation is unusual, but not unheard of.	3
How many of the U.S. servicemen are unaccounted for in Vietnam?	Vietnam counts more than 300,000 of its own soldiers as missing, but poverty and inadequate records have prevented the Vietnamese from doing much to investigate them.	3
What is especially romantic about the Miami beach?	Especially if you're a lusty horseshoe crab and the tide is high.	3
What connection do they believe the decline in the population of sea crabs may have to drugs?	As with most things in nature, one thing is always connected to another.	3
What does Black think about the lack of crabs?	'It helps people. But it's one of these things that's maligned and overlooked, and the more information the better'.	3
What is the relationship between the horseshoe crab and the spider?	It is one of the oldest unchanged species on Earth known to scientists, older than the continents, and exists only in parts of Asia and North America's Atlantic coast.	3
How did the horseshoe crab get its current scientific reputation?	For most of its history, the world regarded it as junk from the sea.	3
What was once believed to be junk from the sea?	Bounties were sometimes placed on its helmeted head to stop it from grazing on more appetizing clams.	3
What is the political context of the river Delta?	The argument spilled into the spotlight in February and March, oddly because storms finally began hitting the state after a sunny, disappointingly dry December and January.	3
What was happening with the storm surge?	And the fight over the extra flow was on.	3
What is being emphasized by water leaders?	People are very worried'. Government scientists say it's important to understand that the Sacramento and the San Joaquin, the state's two longest rivers, are the hub of the water supply for 3 million acres of farmland and 25 million residents.	3
What did Dajani do when the controversy started?	Acquaintances counseled the professor to keep a low profile, stay away from his university campus and consider taking a vacation abroad, he recalled.	3
What is Dajani's stance on Palestine's education system?	Dajani has advocated publicly for Holocaust education among Palestinians and has devoted part of his own classes to the subject.	3
What did the local promoters do?	On this Saturday evening in Beijing, two cellists opened the cases to the loaner instruments and found the bridge on one had come completely off.	3
What other group has the Philadelphia Orchestra performed with?	Also known as the Hollywood Concert Orchestra and the Hollywood Festival Orchestra, the movie-themed ensemble has been making the rounds in China for the last several years.	3
Why are sharks important to the healthy ocean ecosystem?	Sharks are critical to the overall balance of ocean ecosystems, but commercial fishermen catch them by the millions for their fins, cartilage and meat.	3
What is a misleading statement, according to Antonio Fins?	'They are not American sharks or Bahamian sharks or Mexican sharks.	3
What else is not American or Mexican?	They don't know borders or nationalities'.	3
How have those tests been carried out?	But so far marine researchers have encountered no serious problems, and a growing number of agencies plan to purchase them, manufactures said.	3
What has changed in that regard?	By 2011, the numbers of those adolescents who had done so had barely budged, at 80.4 percent.	3
What were some of the people playing the game called?	Some were playing the infamous game in a make-shift gaming den with a TV and an 1980's game console in the back of a van, while others took selfies beside a life-size E.T.	3
What did Armando Ortega do when he found the huge dump of games?	'It was pitch dark here that night, but we came with our flashlights and found dozens of games,' he said.	3
Why are they interested in the game?	The game and its contribution to the demise of Atari have been the source of fascination for video game enthusiasts for 30 years.	3
Why did they decide to do it?	Whether - and most importantly, why - Atari decided to bury thousands or millions of copies of the failed game is part of the urban legend and much speculation on Internet blog posts and forums.	3
When did the bighorn population begin to recover?	Recovery efforts date back to the 1970s when the bighorn population declined to one area - Wheeler Ridge on the northern edge of Kings Canyon.	3
What happened as a result of the re-population of the bighorn?	The herd became the source population for recovery efforts in the 1970s and 1980s that introduced sheep to Mono Basin east of Yosemite and Mount Baxter and Mount Williamson east of Kings Canyon and Sequoia.	3
What is the difference between the two cases?	Both rest on the warrant-less searches of devices unimagined at the time the Fourth Amendment was ratified in 1791.	3
What is Wurie's opinion?	'I think the Riley case, in particular, is incredibly important,' Elizabeth B. Wydra, chief counsel of the liberal Constitutional Accountability Center, said Friday, 'and it should be important for everyone who has a smartphone'.	3
How does the European Union feel about Canada's rejection of its offer?	'The (EU executive) Commission has no intention of passively accepting the NAFO decision,' said Fisheries Commissioner Emma Bonino, speaking to members of the European Parliament.	3
How did other countries respond?	EU delegates boycotted the vote, and Bonino said Tuesday EU fishermen would ignore the allotment and fish the region as before.	3
How much did Canada allot to NAFO in the vote?	With the Feb. 1 vote, Canada was allotted 16,300 tons, compared to 3,400 tons for the European Union.	3
What is the history of the man named by the police as a suspected Serb war criminal?	The man, whose name was withheld, remains under investigation.	3
What happened to the people who were accused of plundering and setting fire to Muslim houses?	Muslim men who resisted were reportedly shot, while women and children were forced to leave.	3
Where was he arrested?	Dusan Tadic, a former policeman and karate expert, was detained in Germany last February.	3
Why do Germans feel that it is understandable considering the evil the Nazis unleashed?	In a country where skinhead hate-mongers periodically firebomb refugee homes, many feel they have a special responsibility to shield the public from anything that could fuel a neo-Nazi resurgence.	3
How many died as a result of typhus?	Sack said at least 20 percent of the total number of inmates died at the 1,255 camps, largely in the Silesia region now in Poland.	3
What did John Sack do that justified his claim that 60,000 to 80,000 ethnic Germans died	Stalin deliberately put Jews in charge of many of the camps.	3
What was the main objection that the author raised in his review?	Sack's style and frequent use of quotations from conversations that occurred a half-century ago were the main objections, he said.	3
How much does that make Sergei Bubka?	Gattaulin won at 5.86 meters (19 feet, 2 3/4 inches).	3
How did Maxim Tarasov do in the meet's biggest surprise?	Bubka did 5.70 meters (18-8 1/2).	3
How much of a gap does that leave between her and the world record?	Her time was 6.95 seconds.	3
